review_id,review
R01,Love it.
R02,Crashes on launch every time. Unusable.
R03,Solid for quick notes but I wish sync was faster across devices. Sometimes edits from my phone take a few minutes to appear on my laptop and once I almost duplicated an entry because I thought it did not save.
R04,Five stars. The widget alone is worth installing.
R05,Okay app. Nothing special but it works.
R06,Battery drain is real. Deleted after two days.
R07,UI is clean. Took me a minute to find settings.
R08,Notifications are way too aggressive even on low.
R09,Great for tracking habits if you keep it simple.
R10,Search is slow when you have a lot saved items.
R11,Please add dark mode. My eyes beg you.
R12,Customer support replied in hours. Impressed.
R13,Maps load wrong sometimes after the last update.
R14,Simple and reliable. Exactly what I needed.
R15,Too many paywalls for basic features.
R16,The onboarding is long but helpful.
R17,Keeps logging me out. Fix this.
R18,Offline mode works better than I expected.
R19,Cute design but missing export options.
R20,Fast. Rarely see loading spinners.
R21,"I use it daily for grocery lists and it never fails me. I share the list with my partner, we both add items throughout the week, and checkout at the store is smoother because everything is categorized. My only nitpick is that reordering sections could be easier."
R22,Audio skips on Bluetooth in my car. Frustrating.
R23,Privacy policy is clearer than most competitors.
R24,Widgets broke after iOS update. Waiting on a patch.
R25,Good concept but the community is pretty quiet.
R26,Reminders fire on time. That is all I wanted.
R27,The free tier is generous compared to similar apps.
R28,Confusing navigation between tabs.
R29,Love the weekly recap email. Short and useful.
R30,Crashes when I attach large photos.
R31,Works great on my tablet. Phone layout feels cramped.
R32,Signing in with SSO was smooth.
R33,I would pay for a one-time purchase but subscriptions add up across apps. If there was a lifetime unlock for basic features I would buy it immediately. Until then I am staying on the free tier and tolerating the ads.
R34,Helpful tutorials but they repeat the same tips.
R35,Export to PDF would make this perfect for work.
R36,Randomly resets my preferences. Happened twice.
R37,Clean charts. I finally understand my spending.
R38,Needs better filters. I scroll forever.
R39,The team ships updates often which I appreciate.
R40,Slow on older phones. Fair warning.
R41,Love the calm color palette. Feels intentional.
R42,Spammy upsells after every action. No thanks.
R43,Reliable scanner. Text recognition is accurate enough.
R44,Wish there was a web version for my laptop.
R45,Good for beginners and the templates help you start fast. Power users may feel limited because automation and integrations are shallow compared with desktop tools. For my workflow I still export notes once a week and finish formatting elsewhere.
R46,Location permission feels broader than necessary.
R47,The sound effects can be turned off. Thank goodness.
R48,Sync conflicts when editing on two devices.
R49,Overall stable. Minor bugs but nothing deal-breaking.
R50,This replaced three other apps for me.
